{
  "filename": "ordinary.pdf",
  "reportType": "VISURA ORDINARIA",
  "companyName": "IMPRESA SINTETICA S.R.L.",
  "registeredOfficeAddress": "ROMA (RM) VIA ESEMPIO 1",
  "reaNumber": "RM - 1234567",
  "taxCode": "12345678901",
  "vatNumber": "12345678901",
  "legalForm": "societa a responsabilita limitata",
  "registrationDate": "2017-12-05"
}
